{
  "id": "simplex",
  "name": "SimpleX Chat",
  "summary": "Mensagens privadas sem identificadores de utilizador, nem sequer números de telefone",
  "description": {
    "en": "A messaging network with no user identifiers at all: no phone number, no username, no account. Conversations happen over unidirectional queues, and the design means the servers cannot see who talks to whom. End-to-end encrypted by default.",
    "pt": "Rede de mensagens sem qualquer identificador de utilizador: sem número de telefone, sem nome de utilizador, sem conta. As conversas passam por filas unidirecionais e o desenho garante que os servidores não conseguem ver quem fala com quem. Cifrado ponta a ponta por omissão."
  },
  "packageName": "chat.simplex.app",
  "license": "AGPL-3.0-only",
  "sourceCode": "https://github.com/simplex-chat/simplex-chat",
  "author": "SimpleX Chat",
  "categories": [
    "communication",
    "privacy"
  ],
  "tags": [
    "messaging",
    "metadata-resistant",
    "no-identifiers"
  ],
  "links": {
    "website": "https://simplex.chat",
    "docs": "https://simplex.chat/docs/"
  },
  "release": {
    "provider": "github",
    "repo": "simplex-chat/simplex-chat",
    "excludePattern": "*.apk.asc",
    "abiAssets": {
      "arm64-v8a": "simplex-aarch64.apk",
      "armeabi-v7a": "simplex-armv7a.apk"
    }
  },
  "playStore": {
    "present": true,
    "url": "https://play.google.com/store/apps/details?id=chat.simplex.app&hl=en&gl=US"
  },
  "addedAt": "2026-10-07",
  "icon": {
    "repo": "simplex-chat/simplex-chat",
    "path": "fastlane/metadata/android/en-US/images/icon.png"
  },
  "screenshots": [
    {
      "repo": "simplex-chat/simplex-chat",
      "path": "fastlane/metadata/android/en-US/images/phoneScreenshots/1.jpg"
    },
    {
      "repo": "simplex-chat/simplex-chat",
      "path": "fastlane/metadata/android/en-US/images/phoneScreenshots/2.jpg"
    },
    {
      "repo": "simplex-chat/simplex-chat",
      "path": "fastlane/metadata/android/en-US/images/phoneScreenshots/3.jpg"
    }
  ],
  "verification": {
    "signingCertSha256": "3c:52:c4:fd:3c:ad:1c:07:c9:b0:0a:70:80:e3:58:fa:b9:fe:fc:b8:af:5a:ec:14:77:65:f1:6d:0f:21:ad:85",
    "pinnedAt": "2026-10-07"
  }
}
