{
  "id": "catima",
  "name": "Catima",
  "summary": "Organiza cartões de fidelização e apresenta os seus códigos de barras",
  "description": {
    "en": "Store loyalty cards, barcodes and other scannable cards on your phone. Keeps a local collection of cards ready to show at the checkout, with no account required.",
    "pt": "Guarda cartões de fidelização, códigos de barras e outros cartões digitalizáveis no telemóvel. Mantém uma coleção local pronta a mostrar na caixa, sem exigir conta."
  },
  "packageName": "me.hackerchick.catima",
  "license": "GPL-3.0-or-later",
  "sourceCode": "https://github.com/CatimaLoyalty/Android",
  "categories": [
    "utilities",
    "productivity"
  ],
  "tags": [
    "loyalty-cards",
    "barcodes",
    "offline"
  ],
  "icon": {
    "repo": "CatimaLoyalty/Android",
    "path": "fastlane/metadata/android/en-US/images/icon.png"
  },
  "screenshots": [
    {
      "repo": "CatimaLoyalty/Android",
      "path": "fastlane/metadata/android/en-US/images/phoneScreenshots/screenshot-01.png"
    },
    {
      "repo": "CatimaLoyalty/Android",
      "path": "fastlane/metadata/android/en-US/images/phoneScreenshots/screenshot-02.png"
    },
    {
      "repo": "CatimaLoyalty/Android",
      "path": "fastlane/metadata/android/en-US/images/phoneScreenshots/screenshot-03.png"
    }
  ],
  "release": {
    "provider": "github",
    "repo": "CatimaLoyalty/Android",
    "assetPattern": "app-foss-release.apk"
  },
  "playStore": {
    "present": true,
    "url": "https://play.google.com/store/apps/details?id=me.hackerchick.catima&hl=en&gl=US"
  },
  "addedAt": "2026-10-08",
  "lastCheckedAt": "2026-10-08",
  "verification": {
    "signingCertSha256": "d4:05:cd:69:ed:e4:c2:20:74:c3:28:fb:82:56:89:a8:4a:b3:fc:a4:b3:fd:f0:b6:cc:13:33:af:62:c6:7e:b3",
    "pinnedAt": "2026-10-08",
    "notes": "Primeiro pin: certificado verificado com apksigner no APK oficial app-foss-release.apk (v2.45.1)."
  },
  "notes": "Entrada revista em 2026-10-08. Código e licença: https://github.com/CatimaLoyalty/Android/blob/HEAD/LICENSE. Release oficial inspecionado: https://github.com/CatimaLoyalty/Android/releases/download/v2.45.1/app-foss-release.apk. Licença GPLv3+ declarada no README. Apenas o APK FOSS para telemóveis; releases de Wear OS não são selecionados.",
  "links": {
    "website": "https://catima.app"
  }
}
