{
  "id": "breezy-weather",
  "name": "Breezy Weather",
  "summary": "App de meteorologia com mais de 50 fontes de dados e widgets detalhados",
  "description": {
    "en": "A feature-rich weather app: over 50 data sources, hourly and daily forecasts, air quality, pollen, alerts, radar and a set of home screen widgets. Free of ads and trackers.",
    "pt": "App de meteorologia cheio de funcionalidades: mais de 50 fontes de dados, previsões horárias e diárias, qualidade do ar, pólen, alertas, radar e vários widgets de ecrã inicial. Sem anúncios nem rastreadores."
  },
  "packageName": "org.breezyweather",
  "license": "LGPL-3.0-only",
  "sourceCode": "https://github.com/breezy-weather/breezy-weather",
  "categories": [
    "weather"
  ],
  "tags": [
    "weather",
    "widgets",
    "forecast",
    "no-ads"
  ],
  "release": {
    "provider": "github",
    "repo": "breezy-weather/breezy-weather",
    "excludePattern": "*freenet*",
    "abiAssets": {
      "arm64-v8a": "breezy-weather-arm64-v8a-v*_standard.apk",
      "armeabi-v7a": "breezy-weather-armeabi-v7a-v*_standard.apk"
    }
  },
  "playStore": {
    "present": false
  },
  "addedAt": "2026-10-07",
  "icon": {
    "repo": "breezy-weather/breezy-weather",
    "path": "fastlane/metadata/android/en-US/images/icon.png"
  },
  "screenshots": [
    {
      "repo": "breezy-weather/breezy-weather",
      "path": "fastlane/metadata/android/en-US/images/phoneScreenshots/01-main-header-light.png"
    },
    {
      "repo": "breezy-weather/breezy-weather",
      "path": "fastlane/metadata/android/en-US/images/phoneScreenshots/02-main-header-dark.png"
    },
    {
      "repo": "breezy-weather/breezy-weather",
      "path": "fastlane/metadata/android/en-US/images/phoneScreenshots/03-main-blocks-1.png"
    }
  ],
  "verification": {
    "signingCertSha256": "29:d4:35:f7:0a:a9:ae:c3:c1:fa:ff:7f:7f:fa:6e:15:78:50:88:d8:7f:06:ec:fc:ab:9c:3c:c6:2d:c2:69:d8",
    "pinnedAt": "2026-10-07"
  }
}
