{
  "id": "hail",
  "name": "Hail",
  "summary": "Congela aplicações: desativa, esconde ou suspende sem as desinstalar",
  "description": {
    "en": "Freezes the apps you are not using: forces them to stop, disables, hides or suspends them, and brings them back when you need them again. The package keeps its data, so the state is reversible — nothing is uninstalled. Freezing what is idle cuts RAM and battery use, and a whole group can be frozen at once. It works through the system's own mechanisms and needs privileges for that: Shizuku, root, or another supported privileged mode. Available operations depend on the chosen mode.",
    "pt": "Congela as aplicações que não estás a usar: força-as a parar, desativa, esconde ou suspende, e devolve-as ao normal quando voltas a precisar delas. O pacote mantém os dados, por isso o estado é reversível — nada é desinstalado. Congelar o que está parado poupa RAM e bateria, e pode congelar-se um grupo inteiro de uma vez. Usa os mecanismos do próprio sistema e precisa de privilégios para isso: Shizuku, root ou outro modo privilegiado suportado. As operações disponíveis dependem do modo escolhido."
  },
  "packageName": "com.aistra.hail",
  "license": "GPL-3.0-or-later",
  "sourceCode": "https://github.com/aistra0528/Hail",
  "author": "aistra0528",
  "categories": [
    "system",
    "tools"
  ],
  "tags": [
    "freeze",
    "debloat",
    "shizuku",
    "app-manager"
  ],
  "icon": {
    "repo": "aistra0528/Hail",
    "path": "fastlane/metadata/android/en-US/images/icon.png"
  },
  "screenshots": [
    {
      "repo": "aistra0528/Hail",
      "path": "fastlane/metadata/android/en-US/images/phoneScreenshots/1.png"
    },
    {
      "repo": "aistra0528/Hail",
      "path": "fastlane/metadata/android/en-US/images/phoneScreenshots/2.png"
    },
    {
      "repo": "aistra0528/Hail",
      "path": "fastlane/metadata/android/en-US/images/phoneScreenshots/3.png"
    }
  ],
  "release": {
    "provider": "github",
    "repo": "aistra0528/Hail",
    "assetPattern": "Hail-v*.apk"
  },
  "playStore": {
    "present": false
  },
  "addedAt": "2026-10-08",
  "verification": {
    "signingCertSha256": "17:c2:46:3c:1e:00:2b:99:cb:50:2c:dc:da:06:7e:83:52:c6:30:ff:c4:d7:af:3f:d4:42:92:6e:54:dd:3e:78",
    "pinnedAt": "2026-10-08"
  },
  "accessRequirements": {
    "mode": "required",
    "methods": [
      "shizuku",
      "root",
      "deviceOwner",
      "dhizuku",
      "systemApp",
      "workProfile"
    ],
    "note": {
      "en": "Freezing needs a privileged working mode. Shizuku or root are options; device owner, Dhizuku, a privileged system app or Island/Insular offer alternatives with different operations. Choose one in the app settings.",
      "pt": "Congelar apps exige um modo de funcionamento privilegiado. Podes usar Shizuku ou root; gestão do dispositivo, Dhizuku, app de sistema privilegiada ou Island/Insular são alternativas com operações diferentes. Escolhe o modo nas definições da app."
    },
    "guideUrl": "https://github.com/aistra0528/Hail#working-mode"
  }
}
